{
  "schemaVersion": 1,
  "workflowListName": "Workflows",
  "itemName": "Workflow",
  "description": "Run the selected Spec Kit phases in order.",
  "copy": {
    "new": "New",
    "viewArtifact": "View artifact",
    "artifactUnavailable": "The artifact is not available yet.",
    "setupRequired": "Complete setup before running a phase."
  }
}
